{
  "status": "PASS",
  "content_type": "product_ui",
  "score": 95,
  "dimensions": {
    "state_clarity": 20,
    "action_clarity": 20,
    "consequence_clarity": 15,
    "task_usefulness": 14,
    "terminology_consistency": 10,
    "human_naturalness": 8,
    "locale_nativeness": 8
  },
  "hard_failures": [],
  "failures": []
}
